{
  "SchemaVersion": "amd-chipset-driver-research-accepted-baseline/1.0",
  "BaselineLabel": "2026-08-09-windows-powershell-5.1-acceptance",
  "FinalToolkitVersion": "1.0.0",
  "GeneratingToolkitVersion": "0.4.3",
  "SourceEvidenceZipFileName": "AmdChipsetDriverResearchEvidence_20260809-110048_Windows.zip",
  "SourceEvidenceZipSha256": "dc149672f32b55a88af97835fcf05d32d4b012d709171eff28a4756c79e74186",
  "SourceRunId": "AmdChipsetDriverResearchEvidence_20260809-110048_Windows",
  "SourceRunOverallStatus": "Pass",
  "SourceRunExitCode": 0,
  "SourceRunDuration": "4m42.5s",
  "Counts": {
    "ReleaseCount": 25,
    "AcquiredArtifacts": 25,
    "ExtractionComplete": 25,
    "InfRecords": 643,
    "KmdfDeclarations": 158,
    "UmdfDeclarations": 25,
    "InfParseFailures": 0
  },
  "ReleaseRange": {
    "Oldest": "2.04.04.111",
    "Newest": "8.07.16.1035"
  },
  "RepositoryNormalization": [
    "Machine-local absolute paths under the accepted tool root were converted to tool-relative logical paths.",
    "ResearchEnvironment in the aggregate inventory was set to null because host environment evidence is run-specific.",
    "AMD installer binaries, raw extraction trees, raw release-note HTML, console transcript, and per-container logs are not committed."
  ],
  "Interpretation": "Research evidence only; no Windows Server compatibility policy is encoded."
}
